<?xml version="1.0" encoding="UTF-8"?>
<!--
/**
 * Smile_ElasticsuiteCore indices configuration validation.
 *
 * DISCLAIMER
 *
 * Do not edit or add to this file if you wish to upgrade Smile ElasticSuite to newer
 * versions in the future.
 *
 *
 * @category  Smile
 * @package   Smile\ElasticsuiteCore
 * @author    Aurelien FOUCRET <aurelien.foucret@smile.fr>
 * @copyright 2018 Smile
 * @license   Open Software License ("OSL") v. 3.0
 */
 -->
<xs:schema xmlns:xs="http://www.w3.org/2001/XMLSchema">

    <xs:element name="requests">
        <xs:complexType>
            <xs:sequence maxOccurs="unbounded" minOccurs="1">
                <xs:element name="request" type="request"/>
            </xs:sequence>
        </xs:complexType>
    </xs:element>

    <xs:complexType name="request">
        <xs:all>
            <xs:element name="filters" type="filtersDefinition" minOccurs="0"/>
        </xs:all>
        <xs:attribute type="xs:string" name="name" use="required" />
        <xs:attribute type="xs:string" name="label" use="required" />
        <xs:attribute type="xs:string" name="index" use="required" />
        <xs:attribute type="xs:string" name="type" use="required" />
        <xs:attribute type="xs:boolean" name="fulltext" use="required" />
    </xs:complexType>

    <xs:complexType name="filtersDefinition">
        <xs:sequence maxOccurs="unbounded" minOccurs="1">
            <xs:element name="filter" type="filterDefinition" />
        </xs:sequence>
    </xs:complexType>

    <xs:complexType name="filterDefinition">
        <xs:simpleContent>
            <xs:extension base="xs:string">
                <xs:attribute type="xs:string" name="name" use="required"/>
            </xs:extension>
        </xs:simpleContent>
    </xs:complexType>
</xs:schema>
