<?xml version="1.0"?>
<!--
/**
 * Smile_ElasticsuiteCatalog search requests configuration.
 *
 * DISCLAIMER
 *
 * Do not edit or add to this file if you wish to upgrade Smile ElasticSuite to newer
 * versions in the future.
 *
 *
 * @category  Smile
 * @package   Smile\ElasticsuiteCatalog
 * @author    Aurelien FOUCRET <aurelien.foucret@smile.fr>
 * @copyright 2018 Smile
 * @license   Open Software License ("OSL") v. 3.0
 */
 -->
<requests xmlns:xsi="http://www.w3.org/2001/XMLSchema-instance"
          xsi:noNamespaceSchemaLocation="urn:magento:module:Smile_ElasticsuiteCore:etc/elasticsuite_search_request.xsd">

    <request name="quick_search_container" label="Catalog Product Search" index="catalog_product" type="product" fulltext="true">
        <filters>
            <filter name="stockFilter">Smile\ElasticsuiteCatalog\Model\Product\Search\Request\Container\Filter\Stock</filter>
            <filter name="visibleInSearch">Smile\ElasticsuiteCatalog\Model\Product\Search\Request\Container\Filter\VisibleInSearch</filter>
            <filter name="blacklistedProducts">Smile\ElasticsuiteCatalog\Model\Product\Search\Request\Container\Filter\SearchBlacklist</filter>
        </filters>
    </request>

    <request name="catalog_view_container" label="Category Product View" index="catalog_product" type="product" fulltext="false">
        <filters>
            <filter name="stockFilter">Smile\ElasticsuiteCatalog\Model\Product\Search\Request\Container\Filter\Stock</filter>
            <filter name="visibleInCatalog">Smile\ElasticsuiteCatalog\Model\Product\Search\Request\Container\Filter\VisibleInCatalog</filter>
        </filters>
    </request>

    <request name="category_search_container" label="Catalog Category Search" index="catalog_category" type="category" fulltext="true"/>

</requests>
